{
  "$schema": "../schemas/node.v1.schema.json",
  "schemaVersion": 1,
  "nodeId": "1681",
  "name": "&f必殺の星環",
  "icon": "IRON_SWORD",
  "tags": [
    "status",
    "offense",
    "strength"
  ],
  "pointType": "CP",
  "pointCost": 1,
  "effects": [
    {
      "type": "status",
      "status": "MELEE_ATTACK",
      "modifierType": "FLAT",
      "value": 2
    },
    {
      "type": "status",
      "status": "SKILL_DAMAGE_INCREASE",
      "modifierType": "FLAT",
      "value": 0.5
    }
  ],
  "unlockCondition": {
    "classId": "swordmaster"
  }
}
