{
  "$schema": "../schemas/node.v1.schema.json",
  "schemaVersion": 1,
  "nodeId": "1422",
  "name": "&b聖光の星路",
  "icon": "SEA_LANTERN",
  "tags": [
    "status",
    "defense",
    "shield",
    "light"
  ],
  "pointType": "CP",
  "pointCost": 1,
  "effects": [
    {
      "type": "status",
      "status": "MAX_SHIELD",
      "modifierType": "FLAT",
      "value": 3
    },
    {
      "type": "status",
      "status": "SUPPORT_POWER",
      "modifierType": "FLAT",
      "value": 1
    }
  ],
  "unlockCondition": {
    "classId": "paladin"
  }
}
