{
  "$schema": "../schemas/node.v1.schema.json",
  "schemaVersion": 1,
  "nodeId": "1320",
  "name": "&d灯火の星脈",
  "icon": "HEART_OF_THE_SEA",
  "tags": [
    "status",
    "resource",
    "health",
    "starlight"
  ],
  "pointType": "CP",
  "pointCost": 1,
  "effects": [
    {
      "type": "status",
      "status": "MAX_HEALTH",
      "modifierType": "FLAT",
      "value": 10.0
    }
  ],
  "unlockCondition": {
    "classId": "mage"
  }
}
