{
  "$schema": "../schemas/node.v1.schema.json",
  "schemaVersion": 1,
  "nodeId": "1434",
  "name": "&b聖域の星環",
  "icon": "SHIELD",
  "tags": [
    "status",
    "defense",
    "shield",
    "light"
  ],
  "pointType": "CP",
  "pointCost": 1,
  "effects": [
    {
      "type": "status",
      "status": "DEFENSE",
      "modifierType": "SCALAR",
      "value": 0.01
    },
    {
      "type": "status",
      "status": "MAGIC_DEFENSE",
      "modifierType": "SCALAR",
      "value": 0.01
    },
    {
      "type": "status",
      "status": "MAX_SHIELD",
      "modifierType": "FLAT",
      "value": 8
    }
  ],
  "unlockCondition": {
    "classId": "paladin"
  }
}
