{
  "$schema": "../schemas/node.v1.schema.json",
  "schemaVersion": 1,
  "nodeId": "1651",
  "name": "&d高速詠唱の星環",
  "icon": "CLOCK",
  "tags": [
    "status",
    "offense",
    "mana",
    "astral"
  ],
  "pointType": "CP",
  "pointCost": 1,
  "effects": [
    {
      "type": "status",
      "status": "CAST_TIME_REDUCTION",
      "modifierType": "FLAT",
      "value": 1.5
    }
  ],
  "unlockCondition": {
    "classId": "wizard"
  }
}
