{
  "$schema": "../schemas/node.v1.schema.json",
  "schemaVersion": 1,
  "nodeId": "2083",
  "name": "&d幻撃の星環",
  "icon": "GHAST_TEAR",
  "tags": [
    "status",
    "offense",
    "astral",
    "dark"
  ],
  "pointType": "CP",
  "pointCost": 1,
  "effects": [
    {
      "type": "status",
      "status": "SKILL_DAMAGE_INCREASE",
      "modifierType": "FLAT",
      "value": 1
    }
  ],
  "unlockCondition": {
    "classId": "phantom_archer"
  }
}
