{
  "$schema": "../schemas/node.v1.schema.json",
  "schemaVersion": 1,
  "nodeId": "1450",
  "name": "&8黒曜護符の星環",
  "icon": "CRYING_OBSIDIAN",
  "tags": [
    "status",
    "defense",
    "durability",
    "astral"
  ],
  "pointType": "CP",
  "pointCost": 1,
  "effects": [
    {
      "type": "status",
      "status": "MAGIC_DEFENSE",
      "modifierType": "SCALAR",
      "value": 0.015
    }
  ],
  "unlockCondition": {
    "classId": "paladin"
  }
}
