{
  "$schema": "../schemas/node.v1.schema.json",
  "schemaVersion": 1,
  "nodeId": "1062",
  "name": "&d大樹の連星",
  "icon": "OAK_SAPLING",
  "tags": [
    "status",
    "primary",
    "resource",
    "health",
    "durability"
  ],
  "pointType": "PP",
  "pointCost": 1,
  "effects": [
    {
      "type": "status",
      "status": "VITALITY",
      "modifierType": "FLAT",
      "value": 3
    },
    {
      "type": "status",
      "status": "MAX_HEALTH",
      "modifierType": "FLAT",
      "value": 25
    }
  ]
}
