{
  "$schema": "../schemas/node.v1.schema.json",
  "schemaVersion": 1,
  "nodeId": "1694",
  "name": "&6天剣の極星",
  "icon": "NETHER_STAR",
  "tags": [
    "status",
    "offense",
    "astral"
  ],
  "pointType": "CP",
  "pointCost": 1,
  "effects": [
    {
      "type": "status",
      "status": "CRITICAL_RATE",
      "modifierType": "FLAT",
      "value": 3
    },
    {
      "type": "status",
      "status": "CRITICAL_DAMAGE",
      "modifierType": "FLAT",
      "value": 10
    }
  ],
  "unlockCondition": {
    "classId": "swordmaster"
  }
}
