{
  "$schema": "../schemas/node.v1.schema.json",
  "schemaVersion": 1,
  "nodeId": "1708",
  "name": "&b受流しの星環",
  "icon": "SHIELD",
  "tags": [
    "status",
    "defense",
    "durability"
  ],
  "pointType": "CP",
  "pointCost": 1,
  "effects": [
    {
      "type": "status",
      "status": "DEFENSE",
      "modifierType": "SCALAR",
      "value": 0.005
    },
    {
      "type": "status",
      "status": "MAGIC_DEFENSE",
      "modifierType": "SCALAR",
      "value": 0.005
    }
  ],
  "unlockCondition": {
    "classId": "swordmaster"
  }
}
