{
  "$schema": "../schemas/node.v1.schema.json",
  "schemaVersion": 1,
  "nodeId": "2282",
  "name": "&b蒼泉の星環",
  "icon": "LAPIS_LAZULI",
  "tags": [
    "status",
    "resource",
    "mana",
    "azure"
  ],
  "pointType": "CP",
  "pointCost": 1,
  "effects": [
    {
      "type": "status",
      "status": "MAX_MANA",
      "modifierType": "FLAT",
      "value": 12
    }
  ],
  "unlockCondition": {
    "classId": "archmage"
  }
}
