{
  "$schema": "../schemas/node.v1.schema.json",
  "schemaVersion": 1,
  "nodeId": "2122",
  "name": "&d遠矢の星環",
  "icon": "BOW",
  "tags": [
    "status",
    "offense",
    "dexterity",
    "wind"
  ],
  "pointType": "CP",
  "pointCost": 1,
  "effects": [
    {
      "type": "status",
      "status": "RANGED_ATTACK",
      "modifierType": "FLAT",
      "value": 1.0
    },
    {
      "type": "status",
      "status": "DEXTERITY",
      "modifierType": "SCALAR",
      "value": 0.005
    }
  ],
  "unlockCondition": {
    "classId": "sharpshooter"
  }
}
