{
  "$schema": "../schemas/node.v1.schema.json",
  "schemaVersion": 1,
  "nodeId": "2324",
  "name": "&a癒術の星環",
  "icon": "GHAST_TEAR",
  "tags": [
    "status",
    "resource",
    "health",
    "astral"
  ],
  "pointType": "CP",
  "pointCost": 1,
  "effects": [
    {
      "type": "status",
      "status": "HEALING_INCREASE",
      "modifierType": "FLAT",
      "value": 2
    }
  ],
  "unlockCondition": {
    "classId": "archmage"
  }
}
